<?xml version='1.0' encoding='UTF-8'?>
<!DOCTYPE dataset SYSTEM "dataset.dtd">
<dataset>
    <FNBL_FILE_DATA_OBJECT id="0" userid="username1" source_uri="fdo" last_update="1234" status="D" local_name="filename" crc="0" h="0" s="0" a="0" d="0" w="0" r="0" x="0" />
    <FNBL_FILE_DATA_OBJECT id="1" userid="username1" source_uri="fdo" last_update="1234" status="D" />
    <FNBL_FILE_DATA_OBJECT id="2" userid="username1" source_uri="fdo" last_update="1234" status="D" local_name="filename2" true_name="truename1.jpg" created="2009-04-22 09:19:42" modified="2009-04-22 10:42:32" accessed="2009-04-22 23:24:00" h="1" s="0" a="1" d="0" w="1" r="0" x="1" cttype="image/jpeg" object_size="1234" />
    <FNBL_FILE_DATA_OBJECT id="3" userid="username1" source_uri="fdo" last_update="1234" status="D" local_name="filename3" />
    <FNBL_FILE_DATA_OBJECT id="4" userid="username1" source_uri="fdo" last_update="1234" status="D" local_name="filename3" />
    <FNBL_FILE_DATA_OBJECT id="5" userid="username1" source_uri="anothersource" last_update="1234" status="N" local_name="filename" />
    <FNBL_FILE_DATA_OBJECT id="1001" userid="username1" source_uri="fdo" last_update="1234" status="D" />
</dataset>
